핵심 개념,모델·전략,주요 수식 또는 지표,입력 데이터,활용 목적,가정,장점,위험·한계,실무 체크포인트,출처
시계열 요인 (Time-series Factors),파마-프렌치 3요인 모델 (Fama-French 3-Factor),"R_{t,s} - r_f = \alpha_s + \beta_1 MktRF_t + \beta_2 SMB_t + \beta_3 HML_t + \epsilon <br> ( R : 수익률, r_f : 무위험이자율, MktRF : 시장프리미엄, SMB : 규모, HML : 가치)","시장 수익률(MktRF), SMB, HML, 개별 주식 수익률",주식 수익률의 원천 설명 및 미래 수익률 예측,요인 수익률의 구조가 과거와 미래에 일정하게 유지됨,"대형주(SPX): 시장, 규모, 가치 요인을 통해 수익률 구조를 체계적으로 설명 가능함","대형주(SPX): 단기(일별) 예측력이 부재하며, 샘플 외(Out-of-sample) 구간에서 마이너스 수익률 등 저조한 성과를 보임",실전 트레이딩보다는 리스크 관리 및 성과 귀속 분석(Attribution)에 유용함,[1]
횡단면 요인 (Cross-sectional Factors),기본적 분석 기반 다요인 모델,"R_{t+1,s} = \alpha_t + \sum [Factor_{i,t} \times Loading_{i,s,t}] + \epsilon <br> ( Factor_i : 재무 지표 요인, Loading_i : 요인 노출도)","P/E, Gross Margin, 부채비율 등 27개 재무 지표",재무제표 데이터를 활용한 차기 분기 수익률 예측,기업의 기본적 재무 특성이 주가 수익률의 차이를 결정함,대형주(SPX): 분기별 재밸런싱 시 안정적인 수익(CAGR 12.3%) 달성 가능,"대형주(SPX): 중소형주 대비 상대적으로 예측력이 낮을 수 있으며, 과도한 변수 사용 시 과적합(Overfitting) 위험이 있음",R^2 값이 매우 낮더라도(약 0.015) 방향성 예측을 통해 충분히 수익 창출 가능함,[1]
횡단면 요인 (ROE/BM),ROE 및 BM 기반 2요인 모델,"ROE_{i,s} = 1 + \frac{NetIncome_i}{BookValue_{i-1}} , BM = \frac{BookValue}{MarketValue}","분기별 순이익, 장부가치, 주가",수익성(ROE)과 가치(BM) 지표를 결합한 월별 수익률 예측,ROE가 높고 BM이 높은(저평가) 주식이 미래에 높은 수익률을 기록함,"중소형주(SML): CAGR 5% 이상의 성과를 보이며, 특히 ROE 단일 요인의 변별력이 강력함",대형주(SPX): 시장 중립 포트폴리오 구성 시 수익률이 0에 수렴하여 팩터 효과가 미미함,순이익이나 장부가치가 음수( - )인 데이터는 필터링을 통해 제거 후 분석 필수,[1]
통계적 요인 (Statistical Factors),주성분 분석 (PCA) 기반 예측 모델,공분산 행렬 대각화(Diagonalization); Factor Loadings = Eigenvectors,개별 주식의 과거 수익률 시계열 (예: 252일 룩백),관찰 불가능한 공통 요인을 추출하여 단기 수익률 예측,"수익률의 공분산 구조가 단기적으로 유지되며, 주성분이 리스크 동인을 대변함","대형주(SPX): 유의미한 예측력을 보이며 우수한 성과(CAGR 15.6%, 샤프지수 1.4) 기록","대형주/중소형주 공통: 결측치(NaN) 제거 등 엄격한 데이터 클렌징이 필수적이며, 계산 복잡도가 높음","제1주성분은 대개 시장(Market) 요인을 의미하며, 롤링 윈도우 방식으로 모델을 지속 갱신해야 함",[1]
옵션 기반 요인 (Option-implied Factors),내재 모멘트(Implied Moments) 전략,"Vol(IV) , Skew(OTM Call IV - OTM Put IV) , Kurtosis","델타 0.5 및 0.25 옵션의 내재변동성(IV), 테너 30일 옵션",옵션 가격에 내재된 정보로 기초자산의 미래 수익률 예측,"옵션 투자자가 정보 우위에 있으며, 리스크 프리미엄이 옵션 가격에 선반영됨",전체 주식: 고변동성·고첨도 주식 매수 등을 통해 유의미한 알파(연 9.68%) 제공 가능,대형주(SPX): 대형주 대상 백테스트 시 수익률이 0에 가까워 예측력이 매우 희박함,"고변동성/고첨도/고왜도 종목을 선별하는 방식이나, 대형주 적용 시 실익이 낮음에 유의",[1]
